 publication_title;print_identifier;online_identifier;date_first_issue_online;num_first_vol_online;num_first_issue_online;date_last_issue_online;num_last_vol_online;num_last_issue_online;title_url;first_author;title_id;embargo_info;coverage_depth;coverage_notes;publisher_name;publication_type;date_monograph_published_print;date_monograph_published_online;monograph_volume;monograph_edition;first_editor;parent_publication_title_id;preceding_publication_title_id;access_type;oclc_number
Strategies of Remembering in Greece under Rome (100 BC - 100 AD);9789088904806;9789088904820;2017;;;;;;https://www.sidestone.com/books/strategies-of-remembering-in-greece-under-rome-100-bc-100-ad;Edited by Tamara M. Dijkstra, Inger N.I. Kuin, Muriel Moser & David Weidgenannt;9789088904806;;fulltext;Title is available for FREE online reading - Full PDF access available for our Library Program subscribers;Sidestone Press;monograph;2017;;;;;;;P;
Engraved Gems. From antiquity to the present;9789088905056;9789088905070;2017;;;;;;https://www.sidestone.com/books/engraved-gems;Edited by Ben van den Bercken & Vivian Baan;9789088905056;;fulltext;Title is available for FREE online reading - Full PDF access available for our Library Program subscribers;Sidestone Press;monograph;2017;;;;;;;P;
De stad en de dood. Archeologische perspectieven;9789088904899;9789088904912;2017;;;;;;https://www.sidestone.com/books/de-stad-en-de-dood;Onder redactie van Roos van Oosten, Rachel Schats, Nico Arts & Jeroen Bouwmeester;9789088904899;;fulltext;Title is available for FREE online reading - Full PDF access available for our Library Program subscribers;Sidestone Press;monograph;2017;;;;;;;P;
Fragmenting the Chieftain. A practice-based study of Early Iron Age Hallstatt C elite burials in the Low Countries;9789088905117;9789088905131;2017;;;;;;https://www.sidestone.com/books/fragmenting-the-chieftain;Sasja van der Vaart-Verschoof;9789088905117;;fulltext;Title is available for FREE online reading - Full PDF access available for our Library Program subscribers;Sidestone Press;monograph;2017;;;;;;;P;
Fragmenting the Chieftain – Catalogue. Late Bronze and Early Iron Age elite burials in the Low Countries;9789088905148;9789088905162;2017;;;;;;https://www.sidestone.com/books/fragmenting-the-chieftain-catalogue;Sasja van der Vaart-Verschoof;9789088905148;;fulltext;Title is available for FREE online reading - Full PDF access available for our Library Program subscribers;Sidestone Press;monograph;2017;;;;;;;P;
The Canino Connections. The history and restoration of ancient Greek vases from the excavations of Lucien Bonaparte, Prince of Canino (1775-1840);9789088904998;9789088905018;2017;;;;;;https://www.sidestone.com/books/the-canino-connections;Edited by Ruurd Binnert Halbertsma;9789088904998;;fulltext;Title is available for FREE online reading - Full PDF access available for our Library Program subscribers;Sidestone Press;monograph;2017;;;;;;;P;
Advances in Digital Scholarly Editing. Papers presented at the DiXiT conferences in The Hague, Cologne, and Antwerp;9789088904837;9789088904851;2017;;;;;;https://www.sidestone.com/books/advances-in-digital-scholarly-editing;Edited by Peter Boot, Anna Cappellotto, Wout Dillen, Franz Fischer, Aodhán Kelly, Andreas Mertgens, Anna-Maria Sichani, Elena Spadini & Dirk van Hulle;9789088904837;;fulltext;Title is available for FREE online reading - Full PDF access available for our Library Program subscribers;Sidestone Press;monograph;2017;;;;;;;P;
Connecting Elites and Regions. Perspectives on contacts, relations and differentiation during the Early Iron Age Hallstatt C period in Northwest and Central Europe;9789088904424;9789088904448;2017;;;;;;https://www.sidestone.com/books/connecting-elites-and-regions;Edited by Robert Schumann and Sasja van der Vaart-Verschoof;9789088904424;;fulltext;Title is available for FREE online reading - Full PDF access available for our Library Program subscribers;Sidestone Press;monograph;2017;;;;;;;P;
Generale Missiven van Gouverneurs-Generaal en Raden aan Heren XVII der Verenigde Oostindische Compagnie Deel xiv: 1761-1767 . Band 1;9789088905339;9789088905353;2017;;;;;;https://www.sidestone.com/books/generale-missiven-deel-xiv-1761-1767-band-1;Bewerkt door Hugo s’Jacob;9789088905339;;fulltext;Title is available for FREE online reading - Full PDF access available for our Library Program subscribers;Sidestone Press;monograph;2017;;;;;;;P;
Generale Missiven van Gouverneurs-Generaal en Raden aan Heren XVII der Verenigde Oostindische Compagnie Deel xiv: 1761-1767 . Band 2;9789088905360;9789088905384;2017;;;;;;https://www.sidestone.com/books/generale-missiven-deel-xiv-1761-1767-band-2;Bewerkt door Hugo s’Jacob;9789088905360;;fulltext;Title is available for FREE online reading - Full PDF access available for our Library Program subscribers;Sidestone Press;monograph;2017;;;;;;;P;
Nineveh. Hoofdstad van een wereldrijk;9789088905469;9789088905476;2017;;;;;;https://www.sidestone.com/books/nineveh;Onder redactie van Lucas P. Petit & Daniele Morandi Bonacossi;9789088905469;;fulltext;Title is available for FREE online reading - Full PDF access available for our Library Program subscribers;Sidestone Press;monograph;2017;;;;;;;P;
Nineveh, the Great City. Symbol of Beauty and Power;9789088904967;9789088904981;2017;;;;;;https://www.sidestone.com/books/nineveh-the-great-city;Edited by Lucas P. Petit, & Daniele Morandi Bonacossi;9789088904967;;fulltext;Title is available for FREE online reading - Full PDF access available for our Library Program subscribers;Sidestone Press;monograph;2017;;;;;;;P;
Metaaltijden (vol. 4). Bijdragen in de studie van de metaaltijden;9789088905278;9789088905292;2017;;;;;;https://www.sidestone.com/books/metaaltijden-vol-4;Edited by Stijn Arnoldussen, Axel Müller & E. Norde;9789088905278;;fulltext;Title is available for FREE online reading - Full PDF access available for our Library Program subscribers;Sidestone Press;monograph;2017;;;;;;;P;
Style and Meaning. Essays on the anthropology of art;9789088904462;9789088904486;2017;;;;;;https://www.sidestone.com/books/style-and-meaning;Anthony Forge (edited by Alison Clark and Nicholas Thomas);9789088904462;;fulltext;Title is available for FREE online reading - Full PDF access available for our Library Program subscribers;Sidestone Press;monograph;2017;;;;;;;P;
Verre forten, Vreemde kusten. Nederlandse verdedigingswerken overzee;9789088904493;9789088904509;2017;;;;;;https://www.sidestone.com/books/verre-forten-vreemde-kusten;Onder redactie van Kees Ampt, Ad Littel en Edwin Paar;9789088904493;;fulltext;Title is available for FREE online reading - Full PDF access available for our Library Program subscribers;Sidestone Press;monograph;2017;;;;;;;P;
Religion, cults & rituals in the medieval rural environment. Religion, Kulte und Rituale in der mittelalterlichen bäuerlichen Umgebung | Réligion, cultes et rituels au milieu rural médiéval;9789088904868;9789088904882;2017;;;;;;https://www.sidestone.com/books/religion-cults-rituals-in-the-medieval-rural-environment;Edited by Christiane Bis-Worch & Claudia Theune;9789088904868;;fulltext;Title is available for FREE online reading - Full PDF access available for our Library Program subscribers;Sidestone Press;monograph;2017;;;;;;;P;
European Archaeology: Identities & Migrations. Archéologie européenne: Identités & Migrations;9789088905209;9789088905223;2017;;;;;;https://www.sidestone.com/books/european-archaeology-identities-migrations;Edited by Laurence Manolakakis, Nathan Schlanger, Anick Coudart;9789088905209;;fulltext;Title is available for FREE online reading - Full PDF access available for our Library Program subscribers;Sidestone Press;monograph;2017;;;;;;;P;
Drawing Lithic Artefacts;9789088905308;9789088903564;2017;;;;;;https://www.sidestone.com/books/drawing-lithic-artefacts;Yannick Raczynski-Henk;9789088905308;;fulltext;Title is available for FREE online reading - Full PDF access available for our Library Program subscribers;Sidestone Press;monograph;2017;;;;;;;P;
Treasures in Trusted Hands. Negotiating the Future of Colonial Cultural Objects;9789088904394;9789088904417;2017;;;;;;https://www.sidestone.com/books/treasures-in-trusted-hands;Jos van Beurden;9789088904394;;fulltext;Title is available for FREE online reading - Full PDF access available for our Library Program subscribers;Sidestone Press;monograph;2017;;;;;;;P;
The Interactive Past. Archaeology, Heritage, and Video Games;9789088904363;9789088904387;2017;;;;;;https://www.sidestone.com/books/the-interactive-past;Edited by Angus A.A. Mol, Csilla E. Ariese-Vandemeulebroucke, Krijn H.J. Boom & Aris Politopoulos;9789088904363;;fulltext;Title is available for FREE online reading - Full PDF access available for our Library Program subscribers;Sidestone Press;monograph;2017;;;;;;;P;
Sailors, Musicians and Monks. The Leatherwork from Dra‘ Abu el Naga (Luxor, Egypt);9789088904158;9789088904172;2017;;;;;;https://www.sidestone.com/books/sailors-musicians-and-monks;André J. Veldmeijer, with contributions by Daniel Polz and Ute Rummel;9789088904158;;fulltext;Title is available for FREE online reading - Full PDF access available for our Library Program subscribers;Sidestone Press;monograph;2017;;;;;;;P;
Novels of Genocide. Remembering and Forgetting the Ethnic Other in Fictional Rwanda;9789088904318;9789088904332;2017;;;;;;https://www.sidestone.com/books/novels-of-genocide;Olivier Nyirubugara;9789088904318;;fulltext;Title is available for FREE online reading - Full PDF access available for our Library Program subscribers;Sidestone Press;monograph;2017;;;;;;;P;
Artisans versus nobility?. Multiple identities of elites and ‘commoners’ viewed through the lens of crafting from the Chalcolithic to the Iron Ages in Europe and the Mediterranean;9789088903960;9789088903984;2017;;;;;;https://www.sidestone.com/books/artisans-versus-nobility;Edited by Ann Brysbaert and Alexis Gorgues ;9789088903960;;fulltext;Title is available for FREE online reading - Full PDF access available for our Library Program subscribers;Sidestone Press;monograph;2017;;;;;;;P;
Interdisciplinarity between Humanities and Science. A Festschrift in honour of Prof. Dr. Henk Kars;9789088904035;9789088904059;2017;;;;;;https://www.sidestone.com/books/interdisciplinarity-between-humanities-and-science;Edited by Sjoerd Kluiving, Lisette Kootker & Rita Hermans;9789088904035;;fulltext;Title is available for FREE online reading - Full PDF access available for our Library Program subscribers;Sidestone Press;monograph;2017;;;;;;;P;
After the deluge. A palaeogeographical reconstruction of Bronze Age West-Frisia (2000-800 BC);9789088904066;9789088904080;2017;;;;;;https://www.sidestone.com/books/after-the-deluge;Wilko van Zijverden;9789088904066;;fulltext;Title is available for FREE online reading - Full PDF access available for our Library Program subscribers;Sidestone Press;monograph;2017;;;;;;;P;
Excavations of Gebel Adda (Lower Nubia). Ancient Nubian Leatherwork. Part I. Sandals and Shoes;9789088904127;9789088904141;2016;;;;;;https://www.sidestone.com/books/excavations-of-gebel-adda-lower-nubia;André J. Veldmeijer;9789088904127;;fulltext;Title is available for FREE online reading - Full PDF access available for our Library Program subscribers;Sidestone Press;monograph;2016;;;;;;;P;
Leatherwork from Elephantine (Aswan, Egypt). Analysis and Catalogue of the Ancient Egyptian & Persian Leather Finds;9789088903717;9789088903724;2016;;;;;;https://www.sidestone.com/books/leatherwork-from-elephantine-aswan-egypt;André J. Veldmeijer;9789088903717;;fulltext;Title is available for FREE online reading - Full PDF access available for our Library Program subscribers;Sidestone Press;monograph;2016;;;;;;;P;
Koninginnen van de Nijl. Macht en schoonheid in het Nieuwe Rijk (1539-1077 v. Chr.) ;9789088903991;9789088904028;2016;;;;;;https://www.sidestone.com/books/koninginnen-van-de-nijl;Onder redactie van Olaf E. Kaper;9789088903991;;fulltext;Title is available for FREE online reading - Full PDF access available for our Library Program subscribers;Sidestone Press;monograph;2016;;;;;;;P;
Koninginnen van de Nijl in vertaling. De oude Egyptenaren aan het woord;9789088904295;9789088904301;2016;;;;;;https://www.sidestone.com/books/koninginnen-van-de-nijl-in-vertaling;Olaf E. Kaper, met bijdragen van Maarten J. Raven en Ben J.J. Haring;9789088904295;;fulltext;Title is available for FREE online reading - Full PDF access available for our Library Program subscribers;Sidestone Press;monograph;2016;;;;;;;P;
Lamak. Ritual objects in Bali;9789088903908;9789088903922;2016;;;;;;https://www.sidestone.com/books/lamak;Francine Brinkgreve;9789088903908;;fulltext;Title is available for FREE online reading - Full PDF access available for our Library Program subscribers;Sidestone Press;monograph;2016;;;;;;;P;
Archäologische Demographie. Methoden, Daten und Bevölkerung der europäischen Bronze- und Eisenzeiten;9789088903939;9789088903953;2016;;;;;;https://www.sidestone.com/books/archaeologische-demographie;Frank Nikulka;9789088903939;;fulltext;Title is available for FREE online reading - Full PDF access available for our Library Program subscribers;Sidestone Press;monograph;2016;;;;;;;P;
The life cycle of structures in experimental archaeology. An object biography approach;9789088903656;9789088903663;2016;;;;;;https://www.sidestone.com/books/the-life-cycle-of-structures-in-experimental-archaeology;Edited by Linda Hurcombe & Penny Cunningham;9789088903656;;fulltext;Title is available for FREE online reading - Full PDF access available for our Library Program subscribers;Sidestone Press;monograph;2016;;;;;;;P;
Ancient Lives. Object, people and place in early Scotland. Essays for David V Clarke on his 70th birthday;9789088903755;9789088903762;2016;;;;;;https://www.sidestone.com/books/ancient-lives;Edited by Fraser Hunter & Alison Sheridan ;9789088903755;;fulltext;Title is available for FREE online reading - Full PDF access available for our Library Program subscribers;Sidestone Press;monograph;2016;;;;;;;P;
Portable Antiquities, Palimpsests, and Persistent Places. A multi-period approach to Portable Antiquities Scheme data in Lincolnshire;9789088903694;9789088903700;2016;;;;;;https://www.sidestone.com/books/portable-antiquities-palimpsests-and-persistent-places;Adam Jonathan Daubney;9789088903694;;fulltext;Title is available for FREE online reading - Full PDF access available for our Library Program subscribers;Sidestone Press;monograph;2016;;;;;;;P;
Metaaltijden (vol. 3). Bijdragen in de studie van de metaaltijden;9789088904004;9789088904011;2016;;;;;;https://www.sidestone.com/books/metaaltijden-vol-3;Edited by Axel Müller & Richard Jansen;9789088904004;;fulltext;Title is available for FREE online reading - Full PDF access available for our Library Program subscribers;Sidestone Press;monograph;2016;;;;;;;P;
Au fil de l’os. Économie et société chez les Rèmes et les Suessions par le prisme de l’archéozoologie;9789088903618;9789088903625;2016;;;;;;https://www.sidestone.com/books/au-fil-de-l-os;Pierre-Emmanuel Paris;9789088903618;;fulltext;Title is available for FREE online reading - Full PDF access available for our Library Program subscribers;Sidestone Press;monograph;2016;;;;;;;P;
La hache de silex dans le Val de Seine. Production et diffusion des haches au Néolithique;9789088903373;9789088903380;2016;;;;;;https://www.sidestone.com/books/la-hache-de-silex-dans-le-val-de-seine;Edited by François Giligny & Françoise Bostyn;9789088903373;;fulltext;Title is available for FREE online reading - Full PDF access available for our Library Program subscribers;Sidestone Press;monograph;2016;;;;;;;P;
Op bezoek bij de Groot-Mogol. Twee hofreizen van de VOC naar de Groot-Mogol in India, 1662 en 1711-1713;9789088903779;9789088903786;2016;;;;;;https://www.sidestone.com/books/op-bezoek-bij-de-groot-mogol;Hans van Santen;9789088903779;;fulltext;Title is available for FREE online reading - Full PDF access available for our Library Program subscribers;Sidestone Press;monograph;2016;;;;;;;P;
Approvisionner Cayenne sous l’Ancien Régime. Archéologie et histoire des réseaux commerciaux;9789088903571;9789088903588;2016;;;;;;https://www.sidestone.com/books/approvisionner-cayenne-sous-l-ancien-regime;Catherine Losier;9789088903571;;fulltext;Title is available for FREE online reading - Full PDF access available for our Library Program subscribers;Sidestone Press;monograph;2016;;;;;;;P;
Flèches de pouvoir à l’aube de la métallurgie de la Bretagne au Danemark (2500-1700 av. n. è.);9789088903052;9789088903069;2016;;;;;;https://www.sidestone.com/books/fleches-de-pouvoir-a-l-aube-de-la-metallurgie;Clément Nicolas;9789088903052;;fulltext;Title is available for FREE online reading - Full PDF access available for our Library Program subscribers;Sidestone Press;monograph;2016;;;;;;;P;
Catalogue: Flèches de pouvoir à l’aube de la métallurgie de la Bretagne au Danemark (2500-1700 av. n. è.);9789088903731;9789088903748;2016;;;;;;https://www.sidestone.com/books/catalogue-fleches-de-pouvoir-a-l-aube-de-la-metallurgie;Clément Nicolas;9789088903731;;fulltext;Title is available for FREE online reading - Full PDF access available for our Library Program subscribers;Sidestone Press;monograph;2016;;;;;;;P;
The Marys of Medieval Drama. The Middle English Digby and N-town in Translation;9789088903670;9789088903687;2016;;;;;;https://www.sidestone.com/books/the-marys-of-medieval-drama;Colleen E. Donnelly;9789088903670;;fulltext;Title is available for FREE online reading - Full PDF access available for our Library Program subscribers;Sidestone Press;monograph;2016;;;;;;;P;
Rome aan de Noordzee. Burgers en barbaren te Velsen;9789088903632;9789088903649;2016;;;;;;https://www.sidestone.com/books/rome-aan-de-noordzee;Arjen V.A.J. Bosman;9789088903632;;fulltext;Title is available for FREE online reading - Full PDF access available for our Library Program subscribers;Sidestone Press;monograph;2016;;;;;;;P;
The indigenous peoples of Trinidad and Tobago from the first settlers until today;9789088903533;9789088903540;2016;;;;;;https://www.sidestone.com/books/the-indigenous-peoples-of-trinidad-and-tobago;Arie Boomert;9789088903533;;fulltext;Title is available for FREE online reading - Full PDF access available for our Library Program subscribers;Sidestone Press;monograph;2016;;;;;;;P;
Massendinghaltung in der Archäologie. Der material turn und die Ur- und Frühgeschichte;9789088903465;9789088903472;2016;;;;;;https://www.sidestone.com/books/massendinghaltung-in-der-archaeologie;Edited by Kerstin P. Hofmann, Thomas Meier, Doreen Mölders & Stefan Schreiber;9789088903465;;fulltext;Title is available for FREE online reading - Full PDF access available for our Library Program subscribers;Sidestone Press;monograph;2016;;;;;;;P;
Indian Detours. Tourism in Native North America;9789088903366;9789088903359;2016;;;;;;https://www.sidestone.com/books/indian-detours;Edited by Pieter Hovens & Mette van der Hooft;9789088903366;;fulltext;Title is available for FREE online reading - Full PDF access available for our Library Program subscribers;Sidestone Press;monograph;2016;;;;;;;P;
Archaeological Investigations between Cayenne Island and the Maroni River. A cultural sequence of western coastal French Guiana from 5000 BP to present;9789088903304;9789088903311;2015;;;;;;https://www.sidestone.com/books/archaeological-investigations-between-cayenne-island-and-the-maroni-river;Martijn van den Bel;9789088903304;;fulltext;Title is available for FREE online reading - Full PDF access available for our Library Program subscribers;Sidestone Press;monograph;2015;;;;;;;P;
Leiden Journal of Pottery Studies vol. 26;1574175326;;2010;;;;;;https://www.sidestone.com/books/leiden-journal-of-pottery-studies-vol-26;Edited by Abraham van As;1574175326;;fulltext;Title is available for FREE online reading - Full PDF access available for our Library Program subscribers;Sidestone Press;monograph;2010;;;;;;;P;
Blijvende inzetbaarheid in langere loopbanen;9789088900440;9789088906787;2010;;;;;;https://www.sidestone.com/books/blijvende-inzetbaarheid-in-langere-loopbanen;Felix J. Steemers;9789088900440;;fulltext;Title is available for FREE online reading - Full PDF access available for our Library Program subscribers;Sidestone Press;monograph;2010;;;;;;;P;
Renewing the house. Trajectories of social life in the yucayeque (community) of El Cabo, Higüey, Dominican Republic, AD 800 to 1504;9789088900457;9789088901140;2010;;;;;;https://www.sidestone.com/books/renewing-the-house;Alice V.M. Samson;9789088900457;;fulltext;Title is available for FREE online reading - Full PDF access available for our Library Program subscribers;Sidestone Press;monograph;2010;;;;;;;P;
Leiden Journal of Pottery Studies vol. 25;1574175325;;2009;;;;;;https://www.sidestone.com/books/leiden-journal-of-pottery-studies-vol-25;Edited by Abraham van As;1574175325;;fulltext;Title is available for FREE online reading - Full PDF access available for our Library Program subscribers;Sidestone Press;monograph;2009;;;;;;;P;
Leiden Journal of Pottery Studies vol. 24;1574175324;;2008;;;;;;https://www.sidestone.com/books/leiden-journal-of-pottery-studies-vol-24;Edited by Abraham van As;1574175324;;fulltext;Title is available for FREE online reading - Full PDF access available for our Library Program subscribers;Sidestone Press;monograph;2008;;;;;;;P;
Leiden Journal of Pottery Studies vol. 23;1574175323;;2007;;;;;;https://www.sidestone.com/books/leiden-journal-of-pottery-studies-vol-23;Edited by Abraham van As;1574175323;;fulltext;Title is available for FREE online reading - Full PDF access available for our Library Program subscribers;Sidestone Press;monograph;2007;;;;;;;P;
Leiden Journal of Pottery Studies vol. 22;1574175322;;2006;;;;;;https://www.sidestone.com/books/leiden-journal-of-pottery-studies-vol-22;Edited by Abraham van As;1574175322;;fulltext;Title is available for FREE online reading - Full PDF access available for our Library Program subscribers;Sidestone Press;monograph;2006;;;;;;;P;
Ceci n'est pas une hache. Neolithic Depositions in the Northern Netherlands;9789088900013;9789088901119;2006;;;;;;https://www.sidestone.com/books/ceci-n-est-pas-une-hache;Karsten Wentink;9789088900013;;fulltext;Title is available for FREE online reading - Full PDF access available for our Library Program subscribers;Sidestone Press;monograph;2006;;;;;;;P;
Leiden Journal of Pottery Studies vol. 21;1574175321;;2005;;;;;;https://www.sidestone.com/books/leiden-journal-of-pottery-studies-vol-21;Edited by Abraham van As;1574175321;;fulltext;Title is available for FREE online reading - Full PDF access available for our Library Program subscribers;Sidestone Press;monograph;2005;;;;;;;P;
Leiden Journal of Pottery Studies vol. 20;1574175320;;2004;;;;;;https://www.sidestone.com/books/leiden-journal-of-pottery-studies-vol-20;Edited by Abraham van As;1574175320;;fulltext;Title is available for FREE online reading - Full PDF access available for our Library Program subscribers;Sidestone Press;monograph;2004;;;;;;;P;
Leiden Journal of Pottery Studies vol. 18-19;157417531819;;2001;;;;;;https://www.sidestone.com/books/leiden-journal-of-pottery-studies-vol-18-19;Edited by Abraham van As;157417531819;;fulltext;Title is available for FREE online reading - Full PDF access available for our Library Program subscribers;Sidestone Press;monograph;2001;;;;;;;P;
Leiden Journal of Pottery Studies vol. 16-17;157417531617;;1998;;;;;;https://www.sidestone.com/books/leiden-journal-of-pottery-studies-vol-16-17;Edited by Abraham van As and Gloria Anne London;157417531617;;fulltext;Title is available for FREE online reading - Full PDF access available for our Library Program subscribers;Sidestone Press;monograph;1998;;;;;;;P;
Leiden Journal of Pottery Studies vol. 14-15;157417531415;;1996;;;;;;https://www.sidestone.com/books/leiden-journal-of-pottery-studies-vol-14-15;Edited by A. van As;157417531415;;fulltext;Title is available for FREE online reading - Full PDF access available for our Library Program subscribers;Sidestone Press;monograph;1996;;;;;;;P;
Leiden Journal of Pottery Studies vol. 13;1574175313;;1995;;;;;;https://www.sidestone.com/books/leiden-journal-of-pottery-studies-vol-13;Edited by A. van As;1574175313;;fulltext;Title is available for FREE online reading - Full PDF access available for our Library Program subscribers;Sidestone Press;monograph;1995;;;;;;;P;
Leiden Journal of Pottery Studies vol. 11-12;157417531112;;1993;;;;;;https://www.sidestone.com/books/leiden-journal-of-pottery-studies-vol-11-12;Edited by A. van As;157417531112;;fulltext;Title is available for FREE online reading - Full PDF access available for our Library Program subscribers;Sidestone Press;monograph;1993;;;;;;;P;
Leiden Journal of Pottery Studies vol. 09-10;157417530910;;1991;;;;;;https://www.sidestone.com/books/leiden-journal-of-pottery-studies-vol-09-10;Edited by A. van As;157417530910;;fulltext;Title is available for FREE online reading - Full PDF access available for our Library Program subscribers;Sidestone Press;monograph;1991;;;;;;;P;
Leiden Journal of Pottery Studies vol. 07-08;157417530708;;1989;;;;;;https://www.sidestone.com/books/leiden-journal-of-pottery-studies-vol-07-08;Edited by A. van As;157417530708;;fulltext;Title is available for FREE online reading - Full PDF access available for our Library Program subscribers;Sidestone Press;monograph;1989;;;;;;;P;
Leiden Journal of Pottery Studies vol. 06;1574175306;;1988;;;;;;https://www.sidestone.com/books/leiden-journal-of-pottery-studies-vol-06;Edited by A. van As;1574175306;;fulltext;Title is available for FREE online reading - Full PDF access available for our Library Program subscribers;Sidestone Press;monograph;1988;;;;;;;P;
