 publication_title;print_identifier;online_identifier;date_first_issue_online;num_first_vol_online;num_first_issue_online;date_last_issue_online;num_last_vol_online;num_last_issue_online;title_url;first_author;title_id;embargo_info;coverage_depth;coverage_notes;publisher_name;publication_type;date_monograph_published_print;date_monograph_published_online;monograph_volume;monograph_edition;first_editor;parent_publication_title_id;preceding_publication_title_id;access_type;oclc_number
The Ancient Egyptian Footwear Project. Final Archaeological Analysis;9789088907326;9789088907340;2019;;;;;;https://www.sidestone.com/books/the-ancient-egyptian-footwear-project;André J. Veldmeijer;9789088907326;;fulltext;Title is available for FREE online reading - Full PDF access available for our Library Program subscribers;Sidestone Press;monograph;2019;;;;;;;P;
Brittenburg. Verdronken hoeksteen van het Romeinse Rijk;9789088907586;9789088907579;2019;;;;;;https://www.sidestone.com/books/brittenburg;Tom Buijtendorp;9789088907586;;fulltext;Title is available for FREE online reading - Full PDF access available for our Library Program subscribers;Sidestone Press;monograph;2019;;;;;;;P;
Onderzoeksgids: Instrumenten van de macht (Band 2). De Staten-Generaal en hun archieven 1576-1796;9789088908828;9789088908842;2019;;;;;;https://www.sidestone.com/books/onderzoeksgids-instrumenten-van-de-macht-band-2;Theo Thomassen;9789088908828;;fulltext;Title is available for FREE online reading - Full PDF access available for our Library Program subscribers;Sidestone Press;monograph;2019;;;;;;;P;
Onderzoeksgids: Instrumenten van de macht (Band 1). De Staten-Generaal en hun archieven 1576-1796;9789088908798;9789088908811;2019;;;;;;https://www.sidestone.com/books/onderzoeksgids-instrumenten-van-de-macht-band-1;Theo Thomassen;9789088908798;;fulltext;Title is available for FREE online reading - Full PDF access available for our Library Program subscribers;Sidestone Press;monograph;2019;;;;;;;P;
Onderzoeksgids. Bestuur en administratie van de Bataafs Franse tijd 1795-1813;9789088908767;9789088908781;2019;;;;;;https://www.sidestone.com/books/onderzoeksgids-bataafs-franse-tijd;J. Roelevink;9789088908767;;fulltext;Title is available for FREE online reading - Full PDF access available for our Library Program subscribers;Sidestone Press;monograph;2019;;;;;;;P;
Cyprus. A Dynamic Island;9789088908590;9789088908606;2019;;;;;;https://www.sidestone.com/books/cyprus-a-dynamic-island;Edited by Ruurd Binnert Halbertsma en Despina Pilides;9789088908590;;fulltext;Title is available for FREE online reading - Full PDF access available for our Library Program subscribers;Sidestone Press;monograph;2019;;;;;;;P;
Das Jungneolithikum in Schleswig-Holstein;9789088907425;9789088907449;2018;;;;;;https://www.sidestone.com/books/das-jungneolithikum-in-schleswig-holstein;Sebastian Schultrich;9789088907425;;fulltext;Title is available for FREE online reading - Full PDF access available for our Library Program subscribers;Sidestone Press;monograph;2018;;;;;;;P;
Local communities in the Big World of prehistoric Northwest Europe;9789088907463;9789088907487;2018;;;;;;https://www.sidestone.com/books/local-communities-in-the-big-world-of-prehistoric-northwest-europe;Edited by C.C. Bakels, Q.P.J. Bourgeois, D.R. Fontijn & R. Jansen;9789088907463;;fulltext;Title is available for FREE online reading - Full PDF access available for our Library Program subscribers;Sidestone Press;monograph;2018;;;;;;;P;
Past Landscapes. The Dynamics of Interaction between Society, Landscape, and Culture;9789088907319;9789088907302;2018;;;;;;https://www.sidestone.com/books/past-landscapes;Edited by Annette Haug, Lutz Käppel & Johannes Müller;9789088907319;;fulltext;Title is available for FREE online reading - Full PDF access available for our Library Program subscribers;Sidestone Press;monograph;2018;;;;;;;P;
Tracing Technoscapes. The Production of Bronze Age Wall Paintings in the Eastern Mediterranean;9789088906879;9789088906893;2018;;;;;;https://www.sidestone.com/books/tracing-technoscapes;Edited by Johannes Becker, Johannes Jungfleisch & Constance von Rüden;9789088906879;;fulltext;Title is available for FREE online reading - Full PDF access available for our Library Program subscribers;Sidestone Press;monograph;2018;;;;;;;P;
Dynamiek in beeld. Onderzoek van Westfriese nederzettingen uit de bronstijd;9789088907418;9789088907401;2018;;;;;;https://www.sidestone.com/books/dynamiek-in-beeld;Wouter Roessingh;9789088907418;;fulltext;Title is available for FREE online reading - Full PDF access available for our Library Program subscribers;Sidestone Press;monograph;2018;;;;;;;P;
Constructing monuments, perceiving monumentality and the economics of building. Theoretical and methodological approaches to the built environment;9789088906961;9789088906985;2018;;;;;;https://www.sidestone.com/books/constructing-monuments;Edited by Ann Brysbaert, Victor Klinkenberg, Anna Gutiérrez Garcia-M., Irene Vikatou;9789088906961;;fulltext;Title is available for FREE online reading - Full PDF access available for our Library Program subscribers;Sidestone Press;monograph;2018;;;;;;;P;
Pacific Presences - Volume 1. Oceanic Art and European Museums;9789088905896;9789088905919;2018;;;;;;https://www.sidestone.com/books/pacific-presences-vol-1;Edited by Lucie Carreau, Alison Clark, Alana Jelinek, Erna Lilje & Nicholas Thomas;9789088905896;;fulltext;Title is available for FREE online reading - Full PDF access available for our Library Program subscribers;Sidestone Press;monograph;2018;;;;;;;P;
Pacific Presences - Volume 2. Oceanic Art and European Museums;9789088906268;9789088906282;2018;;;;;;https://www.sidestone.com/books/pacific-presences-vol-2;Edited by Lucie Carreau, Alison Clark, Alana Jelinek, Erna Lilje & Nicholas Thomas;9789088906268;;fulltext;Title is available for FREE online reading - Full PDF access available for our Library Program subscribers;Sidestone Press;monograph;2018;;;;;;;P;
Collecting in the South Sea. The Voyage of Bruni d’Entrecasteaux 1791-1794;9789088905742;9789088905766;2018;;;;;;https://www.sidestone.com/books/collecting-in-the-south-sea;Edited by Bronwen Douglas, Fanny Wonu Veys, and Billie Lythberg;9789088905742;;fulltext;Title is available for FREE online reading - Full PDF access available for our Library Program subscribers;Sidestone Press;monograph;2018;;;;;;;P;
The Beaker Phenomenon? . Understanding the character and context of social practices in Ireland 2500-2000 BC;9789088904639;9789088904653;2018;;;;;;https://www.sidestone.com/books/the-beaker-phenomenon;Neil Carlin;9789088904639;;fulltext;Title is available for FREE online reading - Full PDF access available for our Library Program subscribers;Sidestone Press;monograph;2018;;;;;;;P;
Océan, céramiques et îles dans l’ouest de la France. Approche archéométrique des relations paléo-économiques des populations insulaires du Néolithique à l’Antiquité;9789088906237;9789088906251;2018;;;;;;https://www.sidestone.com/books/ocean-ceramiques-et-iles-dans-l-ouest-de-la-france;Benjamin Gehres;9789088906237;;fulltext;Title is available for FREE online reading - Full PDF access available for our Library Program subscribers;Sidestone Press;monograph;2018;;;;;;;P;
A Shadow of War. Archaeological approaches to uncovering the darker sides of conflict from the 20th century ;9789088904547;9789088904554;2018;;;;;;https://www.sidestone.com/books/a-shadow-of-war;Claudia Theune;9789088904547;;fulltext;Title is available for FREE online reading - Full PDF access available for our Library Program subscribers;Sidestone Press;monograph;2018;;;;;;;P;
Seascape Corridors. Modeling Routes to Connect Communities Across the Caribbean Sea;9789088905773;9789088905797;2018;;;;;;https://www.sidestone.com/books/seascape-corridors;Emma Ruth Slayton;9789088905773;;fulltext;Title is available for FREE online reading - Full PDF access available for our Library Program subscribers;Sidestone Press;monograph;2018;;;;;;;P;
Imprint of Action. The Sociocultural Impact of Public Activities in Archaeology;9789088906992;9789088907012;2018;;;;;;https://www.sidestone.com/books/imprint-of-action;Krijn H.J. Boom;9789088906992;;fulltext;Title is available for FREE online reading - Full PDF access available for our Library Program subscribers;Sidestone Press;monograph;2018;;;;;;;P;
Goden van Egypte. Op zoek naar de wetten van de kosmos;9789088907210;9789088907203;2018;;;;;;https://www.sidestone.com/books/goden-van-egypte;Redactie: Maarten J. Raven;9789088907210;;fulltext;Title is available for FREE online reading - Full PDF access available for our Library Program subscribers;Sidestone Press;monograph;2018;;;;;;;P;
Goden van Egypte. Van A tot Seth;9789088907272;9789088907289;2018;;;;;;https://www.sidestone.com/books/goden-van-egypte-van-a-tot-seth;Maarten J. Raven en Ben van den Bercken;9789088907272;;fulltext;Title is available for FREE online reading - Full PDF access available for our Library Program subscribers;Sidestone Press;monograph;2018;;;;;;;P;
Transfer between sea and land. Maritime vessels for cultural exchanges in the Early Modern Period;9789088906206;9789088906220;2018;;;;;;https://www.sidestone.com/books/transfer-between-sea-and-land;Edited by Simone Kahlow;9789088906206;;fulltext;Title is available for FREE online reading - Full PDF access available for our Library Program subscribers;Sidestone Press;monograph;2018;;;;;;;P;
Metaaltijden (vol. 5). Bijdragen in de studie van de metaaltijden;9789088907173;9789088907197;2018;;;;;;https://www.sidestone.com/books/metaaltijden-vol-5;Edited by Eugene Ball, Richard Jansen, E.H.L.D. Norde & K.M. de Vries;9789088907173;;fulltext;Title is available for FREE online reading - Full PDF access available for our Library Program subscribers;Sidestone Press;monograph;2018;;;;;;;P;
The Social Museum in the Caribbean . Grassroots Heritage Initiatives and Community Engagement;9789088905926;9789088905940;2018;;;;;;https://www.sidestone.com/books/the-social-museum-in-the-caribbean;Csilla E. Ariese-Vandemeulebroucke;9789088905926;;fulltext;Title is available for FREE online reading - Full PDF access available for our Library Program subscribers;Sidestone Press;monograph;2018;;;;;;;P;
Seafaring and Seafarers in the Bronze Age Eastern Mediterranean;9789088905544;9789088905568;2018;;;;;;https://www.sidestone.com/books/seafaring-and-seafarers-in-the-bronze-age-eastern-mediterranean;A. Bernard Knapp;9789088905544;;fulltext;Title is available for FREE online reading - Full PDF access available for our Library Program subscribers;Sidestone Press;monograph;2018;;;;;;;P;
Landscape, Land-Change & Well-Being in the Lesser Antilles. Case Studies from the coastal villages of St. Kitts and the Kalinago Territory, Dominica;9789088905865;9789088905889;2018;;;;;;https://www.sidestone.com/books/landscape-land-change-well-being-in-the-lesser-antilles;Charlotte Eloise Stancioff;9789088905865;;fulltext;Title is available for FREE online reading - Full PDF access available for our Library Program subscribers;Sidestone Press;monograph;2018;;;;;;;P;
‘The most prominent Dutchman in Egypt’. Jan Herman Insinger and the Egyptian collection in Leiden;9789088905513;9789088905537;2018;;;;;;https://www.sidestone.com/books/the-most-prominent-dutchman-in-egypt;Maarten J. Raven;9789088905513;;fulltext;Title is available for FREE online reading - Full PDF access available for our Library Program subscribers;Sidestone Press;monograph;2018;;;;;;;P;
From Microcosm to Macrocosm. Individual households and cities in Ancient Egypt and Nubia;9789088905988;9789088906008;2018;;;;;;https://www.sidestone.com/books/from-microcosm-to-macrocosm;Edited by Julia Budka & Johannes Auenmüller ;9789088905988;;fulltext;Title is available for FREE online reading - Full PDF access available for our Library Program subscribers;Sidestone Press;monograph;2018;;;;;;;P;
Koloniale mythen en Benedenwindse feiten. Curaçao, Aruba en Bonaire in inheems Atlantisch perspectief, ca. 1499-1636;9789088906015;9789088906022;2018;;;;;;https://www.sidestone.com/books/koloniale-mythen-en-benedenwindse-feiten;Luc Alofs;9789088906015;;fulltext;Title is available for FREE online reading - Full PDF access available for our Library Program subscribers;Sidestone Press;monograph;2018;;;;;;;P;
Palaeolithic Italy. Advanced studies on early human adaptations in the Apennine peninsula;9789088905834;9789088905858;2018;;;;;;https://www.sidestone.com/books/palaeolithic-italy;Edited by Valentina Borgia & Emanuela Cristiani;9789088905834;;fulltext;Title is available for FREE online reading - Full PDF access available for our Library Program subscribers;Sidestone Press;monograph;2018;;;;;;;P;
Beauty en Fashion. De laatste trends uit het Oude Rome;9789088906381;9789088906398;2018;;;;;;https://www.sidestone.com/books/beauty-en-fashion;Dorothee Olthof & Martine Teunissen;9789088906381;;fulltext;Title is available for FREE online reading - Full PDF access available for our Library Program subscribers;Sidestone Press;monograph;2018;;;;;;;P;
Chariots in Ancient Egypt. The Tano Chariot, A Case Study;9789088904660;9789088904684;2018;;;;;;https://www.sidestone.com/books/chariots-in-ancient-egypt;Edited by André J. Veldmeijer & Salima Ikram, with contributions by Ole Herslund, Lisa Sabbahy & Lucy Skinner;9789088904660;;fulltext;Title is available for FREE online reading - Full PDF access available for our Library Program subscribers;Sidestone Press;monograph;2018;;;;;;;P;
Fighting Fibres. Kiribati Armour and Museum Collections;9789088905650;9789088905674;2018;;;;;;https://www.sidestone.com/books/fighting-fibres;Edited by Julie Adams, Polly Bence and Alison Clark;9789088905650;;fulltext;Title is available for FREE online reading - Full PDF access available for our Library Program subscribers;Sidestone Press;monograph;2018;;;;;;;P;
Debating Religious Space and Place in the Early Medieval World (c. AD 300-1000);9789088904189;9789088904202;2018;;;;;;https://www.sidestone.com/books/debating-religious-space-and-place-in-the-early-medieval-world;Edited by Chantal Bielmann and Brittany Thomas;9789088904189;;fulltext;Title is available for FREE online reading - Full PDF access available for our Library Program subscribers;Sidestone Press;monograph;2018;;;;;;;P;
Exploring human nature. A reflexive mixed methods enquiry into Solo time in the wilderness;9789088905582;9789088905605;2018;;;;;;https://www.sidestone.com/books/exploring-human-nature;Jana Lemke;9789088905582;;fulltext;Title is available for FREE online reading - Full PDF access available for our Library Program subscribers;Sidestone Press;monograph;2018;;;;;;;P;
Reframing Luchino Visconti. Film and Art;9789088905483;9789088905506;2018;;;;;;https://www.sidestone.com/books/reframing-luchino-visconti;Ivo Blom;9789088905483;;fulltext;Title is available for FREE online reading - Full PDF access available for our Library Program subscribers;Sidestone Press;monograph;2018;;;;;;;P;
Exorcism, illness and demons in an ancient Near Eastern context. The Egyptian magical Papyrus Leiden I 343 + 345;9789088905391;9789088905414;2018;;;;;;https://www.sidestone.com/books/exorcism-illness-and-demons-in-an-ancient-near-eastern-context;Susanne Beck;9789088905391;;fulltext;Title is available for FREE online reading - Full PDF access available for our Library Program subscribers;Sidestone Press;monograph;2018;;;;;;;P;
Manipulations post-mortem du corps humain. Implications archéologiques et anthropologiques;9789088905438;9789088905452;2018;;;;;;https://www.sidestone.com/books/manipulations-post-mortem-du-corps-humain;Jennifer Kerner;9789088905438;;fulltext;Title is available for FREE online reading - Full PDF access available for our Library Program subscribers;Sidestone Press;monograph;2018;;;;;;;P;
Una Isla, Dos Mundos. Estudio arqueológico sobre el paisaje indígena de Haytí y su transformación al paisaje colonial de La Española (1200-1550);9789088905711;9789088905735;2018;;;;;;https://www.sidestone.com/books/una-isla-dos-mundos;Eduardo Herrera Malatesta;9789088905711;;fulltext;Title is available for FREE online reading - Full PDF access available for our Library Program subscribers;Sidestone Press;monograph;2018;;;;;;;P;
The Arts of Making in Ancient Egypt. Voices, images, and objects of material producers 2000–1550 BC;9789088905230;9789088905254;2018;;;;;;https://www.sidestone.com/books/the-arts-of-making-in-ancient-egypt;Edited by Gianluca Miniaci, Juan Carlos Moreno García, Stephen Quirke & Andréas Stauder;9789088905230;;fulltext;Title is available for FREE online reading - Full PDF access available for our Library Program subscribers;Sidestone Press;monograph;2018;;;;;;;P;
Classicale Acta 1573-1620. Deel X. Band 2. Particuliere synode Zuid-Holland, Classis Brielle 1574-1623;9789088906732;9789088906756;2018;;;;;;https://www.sidestone.com/books/classicale-acta-1573-1620-deel-x-band-2;Bewerkt door dr. W.G. Visser;9789088906732;;fulltext;Title is available for FREE online reading - Full PDF access available for our Library Program subscribers;Sidestone Press;monograph;2018;;;;;;;P;
Classicale Acta 1573-1620. Deel X. Band 1. Particuliere synode Zuid-Holland, Classis Brielle 1574-1623;9789088906701;9789088906725;2018;;;;;;https://www.sidestone.com/books/classicale-acta-1573-1620-deel-x-band-1;Bewerkt door dr. W.G. Visser;9789088906701;;fulltext;Title is available for FREE online reading - Full PDF access available for our Library Program subscribers;Sidestone Press;monograph;2018;;;;;;;P;
Classicale Acta 1573-1620. Deel IX. Band 2. Provinciale synode Gelderland;9789088906671;9789088906695;2018;;;;;;https://www.sidestone.com/books/classicale-acta-1573-1620-deel-ix-band-2;Bewerkt door C. Ravensbergen;9789088906671;;fulltext;Title is available for FREE online reading - Full PDF access available for our Library Program subscribers;Sidestone Press;monograph;2018;;;;;;;P;
Classicale Acta 1573-1620. Deel IX. Band 1. Provinciale synode Gelderland;9789088906640;9789088906664;2018;;;;;;https://www.sidestone.com/books/classicale-acta-1573-1620-deel-ix-band-1;Bewerkt door C. Ravensbergen;9789088906640;;fulltext;Title is available for FREE online reading - Full PDF access available for our Library Program subscribers;Sidestone Press;monograph;2018;;;;;;;P;
The urban graveyard. Archaeological perspectives;9789088905025;9789088905049;2018;;;;;;https://www.sidestone.com/books/the-urban-graveyard;Edited by Roos van Oosten, Rachel Schats, Kerry Fast, Nico Arts & Jeroen Bouwmeester;9789088905025;;fulltext;Title is available for FREE online reading - Full PDF access available for our Library Program subscribers;Sidestone Press;monograph;2018;;;;;;;P;
We graven hier niet de bijbel op!. De Nederlandse opgraving op Tell Deir Alla (1960-1967);9789088905612;9789088905629;2018;;;;;;https://www.sidestone.com/books/we-graven-hier-niet-de-bijbel-op;Margreet L. Steiner & Bart Wagemakers;9789088905612;;fulltext;Title is available for FREE online reading - Full PDF access available for our Library Program subscribers;Sidestone Press;monograph;2018;;;;;;;P;
Bronnen betreffende Kerk en School in de gouvernementen Ambon, Ternate en Banda ten tijde van de Verenigde Oost-Indische Compagnie (VOC), 1605-1791. Vierde deel, Gouvernement Banda 1622-1790;9789088905957;9789088905971;2018;;;;;;https://www.sidestone.com/books/bronnen-betreffende-kerk-en-school-in-de-gouvernementen-ambon-deel-4;Bezorgd door Hendrik E. Niemeijer en Th. van den End, m.m.v. G.J. Schutte;9789088905957;;fulltext;Title is available for FREE online reading - Full PDF access available for our Library Program subscribers;Sidestone Press;monograph;2018;;;;;;;P;
Bronnen betreffende Kerk en School in de gouvernementen Ambon, Ternate en Banda ten tijde van de Verenigde Oost-Indische Compagnie (VOC), 1605-1791. Derde deel, Gouvernement Banda 1622-1790;9789088906619;9789088906633;2018;;;;;;https://www.sidestone.com/books/bronnen-betreffende-kerk-en-school-in-de-gouvernementen-ambon-deel-3;Bezorgd door Hendrik E. Niemeijer en Th. van den End, m.m.v. G.J. Schutte;9789088906619;;fulltext;Title is available for FREE online reading - Full PDF access available for our Library Program subscribers;Sidestone Press;monograph;2018;;;;;;;P;
Bronnen betreffende Kerk en School in de gouvernementen Ambon, Ternate en Banda ten tijde van de Verenigde Oost-Indische Compagnie (VOC), 1605-1791. Tweede deel, tweede band, Gouvernement Ternate 1698-1791;9789088906589;9789088906602;2018;;;;;;https://www.sidestone.com/books/bronnen-betreffende-kerk-en-school-in-de-gouvernementen-ambon-deel-2-band-2;Bezorgd door Hendrik E. Niemeijer en Th. van den End, m.m.v. G.J. Schutte;9789088906589;;fulltext;Title is available for FREE online reading - Full PDF access available for our Library Program subscribers;Sidestone Press;monograph;2018;;;;;;;P;
Bronnen betreffende Kerk en School in de gouvernementen Ambon, Ternate en Banda ten tijde van de Verenigde Oost-Indische Compagnie (VOC), 1605-1791. Tweede deel, eerste band, Gouvernement Ternate 1612-1697;9789088906558;9789088906572;2018;;;;;;https://www.sidestone.com/books/bronnen-betreffende-kerk-en-school-in-de-gouvernementen-ambon-deel-2-band-1;Bezorgd door Hendrik E. Niemeijer en Th. van den End, m.m.v. G.J. Schutte;9789088906558;;fulltext;Title is available for FREE online reading - Full PDF access available for our Library Program subscribers;Sidestone Press;monograph;2018;;;;;;;P;
Bronnen betreffende Kerk en School in de gouvernementen Ambon, Ternate en Banda ten tijde van de Verenigde Oost-Indische Compagnie (VOC), 1605-1791. Eerste deel, tweede band, Gouvernement Ambon 1690-1791;9789088906527;9789088906541;2018;;;;;;https://www.sidestone.com/books/bronnen-betreffende-kerk-en-school-in-de-gouvernementen-ambon-deel-1-band-2;Bezorgd door Hendrik E. Niemeijer en Th. van den End, m.m.v. G.J. Schutte;9789088906527;;fulltext;Title is available for FREE online reading - Full PDF access available for our Library Program subscribers;Sidestone Press;monograph;2018;;;;;;;P;
Bronnen betreffende Kerk en School in de gouvernementen Ambon, Ternate en Banda ten tijde van de Verenigde Oost-Indische Compagnie (VOC), 1605-1791. Eerste deel, eerste band, Gouvernement Ambon 1605-1690;9789088906497;9789088906510;2018;;;;;;https://www.sidestone.com/books/bronnen-betreffende-kerk-en-school-in-de-gouvernementen-ambon-deel-1-band-1;Bezorgd door Hendrik E. Niemeijer en Th. van den End, m.m.v. G.J. Schutte;9789088906497;;fulltext;Title is available for FREE online reading - Full PDF access available for our Library Program subscribers;Sidestone Press;monograph;2018;;;;;;;P;
Bronnen voor de geschiedenis der dagvaarten van de Staten van Zeeland 1318-1572: Band 1. Inleiding, lijsten en teksten 1318-1478;9789088906404;9789088906428;2018;;;;;;https://www.sidestone.com/books/dagvaarten-van-de-staten-van-zeeland-band-1;Uitgegeven door J.G. Smit, J.W.J. Burgers en E.T. van der Vlist;9789088906404;;fulltext;Title is available for FREE online reading - Full PDF access available for our Library Program subscribers;Sidestone Press;monograph;2018;;;;;;;P;
Bronnen voor de geschiedenis der dagvaarten van de Staten van Zeeland 1318-1572: Band 2. Teksten 1479-1536;9789088906435;9789088906459;2018;;;;;;https://www.sidestone.com/books/dagvaarten-van-de-staten-van-zeeland-band-2;Uitgegeven door J.G. Smit, J.W.J. Burgers en E.T. van der Vlist;9789088906435;;fulltext;Title is available for FREE online reading - Full PDF access available for our Library Program subscribers;Sidestone Press;monograph;2018;;;;;;;P;
Bronnen voor de geschiedenis der dagvaarten van de Staten van Zeeland 1318-1572: Band 3. Teksten 1536-1572 en indices;9789088906466;9789088906480;2018;;;;;;https://www.sidestone.com/books/dagvaarten-van-de-staten-van-zeeland-band-3;Uitgegeven door J.G. Smit, J.W.J. Burgers en E.T. van der Vlist;9789088906466;;fulltext;Title is available for FREE online reading - Full PDF access available for our Library Program subscribers;Sidestone Press;monograph;2018;;;;;;;P;
Mobility and Pottery Production. Archaeological and Anthropological Perspectives;9789088904608;9789088904622;2017;;;;;;https://www.sidestone.com/books/mobility-and-pottery-production;Edited by Caroline Heitz & Regine Stapfer;9789088904608;;fulltext;Title is available for FREE online reading - Full PDF access available for our Library Program subscribers;Sidestone Press;monograph;2017;;;;;;;P;
Archaeology and Geomatics. Harvesting the benefits of 10 years of training in the Iberian Peninsula (2006-2015);9789088904516;9789088904530;2017;;;;;;https://www.sidestone.com/books/archaeology-and-geomatics;Edited by Victorino Mayoral Herrera, César Parcero-Oubiña & Pastor Fábrega-Álvarez;9789088904516;;fulltext;Title is available for FREE online reading - Full PDF access available for our Library Program subscribers;Sidestone Press;monograph;2017;;;;;;;P;
Archaeology of Touchstones. An introduction based on finds from Birka, Sweden;9789088905179;9789088905193;2017;;;;;;https://www.sidestone.com/books/archaeology-of-touchstones;Martin Ježek;9789088905179;;fulltext;Title is available for FREE online reading - Full PDF access available for our Library Program subscribers;Sidestone Press;monograph;2017;;;;;;;P;
The Coffins of the Priests of Amun . Egyptian coffins from the 21st Dynasty in the collection of the National Museum of Antiquities in Leiden;9789088904929;9789088904943;2017;;;;;;https://www.sidestone.com/books/the-coffins-of-the-priests-of-amun;Edited by Lara Weiss;9789088904929;;fulltext;Title is available for FREE online reading - Full PDF access available for our Library Program subscribers;Sidestone Press;monograph;2017;;;;;;;P;
